{
  "active": true,
  "cap": null,
  "card_id": "sc_cathay_mastercard_priority",
  "description": "「指定類別簽賬獎賞」限時優惠——海外（外幣）簽賬。比率好過永久 base rate（HK$6=1里）。",
  "end_date": "2026-12-31",
  "match": {
    "channel": null,
    "currency": [
      "FOREIGN"
    ],
    "mcc_exclude": null,
    "mcc_include": null,
    "merchant_exclude": null,
    "merchant_include": null,
    "min_spend_per_txn": null
  },
  "new_customer_only": false,
  "promotion_id": "sc_cathay_mastercard_priority_2026q1_overseas",
  "provenance": {
    "check_fail_count": 0,
    "confidence": "official",
    "content_hash": "f632df7ffc9341ffee21464ed24ffe33fb87c9d647313c9c89251e6844101c50",
    "evidence_excerpt": "Applicable to Standard Chartered Cathay Mastercard – Priority Banking: Every HKD3 in \"Overseas\" category → 1 Mile.",
    "last_checked_at": "2026-08-20T14:00:00.000Z",
    "last_verified_at": "2026-08-20T14:00:00.000Z",
    "source_url": "https://av.sc.com/hk/content/docs/hk-cc-cx-card-selected-category-tnc.pdf"
  },
  "registration_url": null,
  "requires_registration": false,
  "reward": {
    "bonus_amount": null,
    "hkd_per_mile": 3,
    "multiplier": null,
    "rate": null,
    "type": "miles"
  },
  "stacking": {
    "priority": 10,
    "stack_group": "sc_cathay_mastercard_priority_2026_categories",
    "stackable_with_base": false
  },
  "start_date": "2026-01-01",
  "title": "海外（外幣）簽賬 —— 指定類別簽賬獎賞（2026，優先理財）"
}
