{
  "active": true,
  "cap": null,
  "card_id": "sc_cathay_mastercard",
  "description": "「指定類別簽賬獎賞」限時優惠——海外（外幣）簽賬。比率好過永久 base rate（HK$6=1里）。同「食肆及酒店」呢個 promotion 互斥（同一 stack_group）：一筆交易如果同時符合食肆/酒店 MCC 又係外幣，只會計其中一個類別（銀行酌情決定）。",
  "end_date": "2026-12-31",
  "match": {
    "channel": null,
    "currency": [
      "FOREIGN"
    ],
    "mcc_exclude": null,
    "mcc_include": null,
    "merchant_exclude": null,
    "merchant_include": null,
    "min_spend_per_txn": null
  },
  "new_customer_only": false,
  "promotion_id": "sc_cathay_mastercard_2026q1_overseas",
  "provenance": {
    "check_fail_count": 0,
    "confidence": "official",
    "content_hash": "f632df7ffc9341ffee21464ed24ffe33fb87c9d647313c9c89251e6844101c50",
    "evidence_excerpt": "Every HKD4 in \"Dining\", \"Hotels\" and \"Overseas\" category → 1 Mile. Eligible transactions within Overseas category: Transactions posted to the Card account in a currency other than Hong Kong Dollars.",
    "last_checked_at": "2026-08-20T13:30:00.000Z",
    "last_verified_at": "2026-08-20T13:30:00.000Z",
    "source_url": "https://av.sc.com/hk/content/docs/hk-cc-cx-card-selected-category-tnc.pdf"
  },
  "registration_url": null,
  "requires_registration": false,
  "reward": {
    "bonus_amount": null,
    "hkd_per_mile": 4,
    "multiplier": null,
    "rate": null,
    "type": "miles"
  },
  "stacking": {
    "priority": 10,
    "stack_group": "sc_cathay_mastercard_2026_categories",
    "stackable_with_base": false
  },
  "start_date": "2026-01-01",
  "title": "海外（外幣）簽賬 —— 指定類別簽賬獎賞（2026）"
}
